{
    "$schema": "http://json-schema.org/draft-04/schema#",

    "type": "object",

    "properties":
    {
        "first_name":          { "type": "string" },
        "last_name":           { "type": "string" },
        "email":               { "type": "string", "format": "email", "pattern": "^[^@]+@[^@]+$" },
        "password":            { "type": "string" },
        "height":              { "type": "number" },
        "weight":              { "type": "number" },
        "sex":                 { "type": "string" },
        "dob":                 { "type": "string", "pattern": "^[0-9]{4}-[0-9]{2}-[0-9]{2}$" },
        "diabetes_type":       { "type": "integer"},
        "high_blood_pressure": { "type": "boolean"},
        "pregnant":            { "type": "boolean"},
        "insulin_tdd":         { "type": "number" },
        "background_dose":     { "type": "number" },
        "pre_meal_target":     { "type": "number" },
        "post_meal_target":    { "type": "number" }
    },
    "required": ["first_name", "last_name", "email", "password",
                 "height", "weight", "sex", "dob", "diabetes_type",
                 "high_blood_pressure", "pregnant", "insulin_tdd",
                 "background_dose", "pre_meal_target", "post_meal_target"]
}
