{
        "first_name":  "Jonathan",
        "last_name":   "Gillett",
        "email":       "hello5@gmail.com",
        "password":    "test",
        "height":      1.9,    
        "weight":      90.7,  
        "sex":         "M",
        "dob":         "1990-05-17",
        "diabetes_type": 1,
        "high_blood_pressure": false, 
        "pregnant": false,
        "insulin_tdd": 34,    
        "background_dose": 2,     
        "pre_meal_target": 6.2,  
        "post_meal_target": 8.9
}